sign_id,sign_name,category,description,dimensions,price,lead_time
NS001,Custom LED Channel Letters,LED Channel Letters,"Premium illuminated channel letters with LED modules. Weather-resistant aluminum construction with acrylic faces. Perfect for storefronts and business identification.",Custom Size,€2500-€8000,2-3 weeks
NS002,Neon Flex Restaurant Sign,Neon Flex Signs,"Flexible LED neon strip in custom shapes. Energy-efficient alternative to traditional neon. Suitable for restaurants, bars, and hospitality businesses.",Up to 5m length,€800-€2500,1-2 weeks
NS003,Backlit Fabric Lightbox,Lightbox Signs,"Large format backlit display with fabric graphics. Easy to change graphics, perfect for seasonal promotions and advertising campaigns.",2m x 3m,€1200-€3500,2-4 weeks
NS004,3D Illuminated Logo,3D Logos,"Dimensional company logo with integrated LED lighting. Premium finish options including brushed aluminum and powder coating.",Various sizes,€1500-€5000,3-4 weeks
NS005,Digital LED Display,Digital Displays,"Full-color programmable LED screen for dynamic content. Weather-resistant for outdoor use. Perfect for advertising and information display.",3m x 2m,€15000-€25000,4-6 weeks
NS006,Vintage Neon Bar Sign,Traditional Neon,"Hand-bent glass neon tubing in classic style. Available in multiple colors. Perfect for bars, cafes, and vintage-style businesses.",60cm x 40cm,€600-€1200,3-5 weeks
NS007,Illuminated Safety Signs,Safety Signage,"Emergency exit and safety signage with LED backlighting. Compliant with Dutch safety regulations. Battery backup included.",Standard sizes,€150-€400,1 week
NS008,Window Graphics with LED,Window Displays,"Perforated vinyl graphics combined with LED edge lighting. Maximizes window space for advertising while maintaining visibility.",Custom size,€400-€1500,1-2 weeks
